{
  "schemaVersion": 2,
  "id": "verify",
  "repository": "sample",
  "purpose": "Exercise fixture verification",
  "kind": "command",
  "cwd": ".",
  "category": "unit-test",
  "activities": [
    "research",
    "testing",
    "implementation",
    "review"
  ],
  "command": "node",
  "args": [
    "verify.mjs"
  ],
  "timeoutSeconds": 120,
  "generatedDirectories": [],
  "artifacts": [],
  "probes": []
}
