{
  "schemaVersion": 2,
  "purpose": "Exercise a managed local HTTP service",
  "repository": "http-sample",
  "cwd": ".",
  "category": "http-check",
  "activities": [
    "research",
    "testing",
    "implementation",
    "review"
  ],
  "timeoutSeconds": 120,
  "generatedDirectories": [],
  "artifacts": [],
  "probes": [],
  "id": "health",
  "kind": "http",
  "http": {
    "serviceId": "serve",
    "path": "/health",
    "expectedStatus": 200
  }
}